Name,Address,Time,Close,Tel,PASELI
ラウンドワン富士店,静岡県富士市八代町4-15, 10:00-24:00, 無し, 0545-51-3636,1
スーパーウェーブ吉原店,静岡県富士市田島字窪田72-15, 10:00-24:00, 無し, 054-557-5001,1
3RDプラネット島田店,静岡県島田市中溝町2531, 10:00-24:00, 無し, 0547-34-2556,1
ACT御殿場,静岡県御殿場市東山字石橋296-1, 10:00-24:00, 無し, 0550-70-0001,1
3RDプラネットBivi沼津店,静岡県沼津市大手町1-1-5, 9:00-24:00, 無し, 055-926-7739,1
ラウンドワン浜松店,静岡県浜松市東区天王町諏訪1981-17, 10:00-24:00/土9:00-24:00/日・祝8:00-24:00, 無し, 053-461-1101,1
楽市楽座 サンストリート浜北店,静岡県浜松市浜北区平口2861サンストリート浜北内 M-207, 10:00-24:00, 無し, 0535-84-6136,1
ポート24浜松店,静岡県浜松市西区坪井町4183, 10:00-24:00, 無休, 053-440-5588,1
シートピアYAZ焼津店,静岡県焼津市道原585, 10:00-24:00, 無休, 054-623-8555,1
アップル新北街道店,静岡県静岡市葵区沓谷5-13-4, 10:00-24:00, 無休, 054-261-9109,1
SUPERWAVE静岡,静岡県静岡市駿河区中吉田15-8プラザアピア静岡内2F, 10:00-24:00, 無し, 054-263-0622,1
ラウンドワン静岡駿河店,静岡県静岡市駿河区手越75, 10:00-24:00, 無し, 054-201-1601,1
LAND柿田川店,静岡県駿東郡清水町玉川61-2,,, 055-973-8020,1
