Name,Address,Time,Close,Tel,PASELI
ビバーチャ2,広島県広島市中区平野町10-16, 10:00-24:00, 無し, 082-504-7575,1
Spica広島八丁堀店,広島県広島市中区新天地5-3ドン･キホーテB1F, 10:00-23:35, 無し, 082-543-2770,1
ラウンドワン広島店,広島県広島市中区立町3-11, 10:00-24:00/土・日7:30-24:00, 無し, 082-545-8910,1
アルティランドアルパーク北棟店,広島県広島市西区草津南4-7-1, 10:00-24:00, 無し, 082-270-5734,1
アミパラ広島店,広島県広島市西区西観音町3-17, 10:00-24:00, 無し, 082-297-7135,1
アミパラここじゃ,広島県東広島市西条町下見6-10-19山手電気内, 10:00-24:00, 無し, 0824-24-4747,1
ラウンドワン福山店,広島県福山市明神町1-9-28, 10:00-24:00, 無し, 084-973-9891,1
アミパラキャッスル,広島県福山市東深津町4-16-25, 10:00-24:00, 無し, 084-925-8867,1
